{
  "version": 1,
  "title": "Prototype Annotations",
  "inputs": [
    {
      "scope": "module-a",
      "config": "./module-a/annotation.config.json",
      "order": 1
    },
    {
      "scope": "module-b",
      "config": "./module-b/annotation.config.json",
      "order": 2
    }
  ],
  "runtime": {
    "zIndexBase": 2147480000,
    "initialMode": "preview"
  },
  "output": "../../public/annotation-kit/annotation.bundle.json",
  "coverage": "./coverage.md",
  "htmlOutput": "./annotations.html"
}
